A,abstract
2020,"The protective relay apparatus computes the second limiting current at the angular based on the primary current and the secondary current the second secondary 2 current at the angular is produced based on the first secondary 2 current the first secondary 2 current at the angular and the first limiting current is produced on basis of the primary current and the secondary current of the transformer. The protective relay apparatus comprises the first secondary 2 current, the first differential relay element, executing the rate differential operational based on the first limiting current and the second secondary 2 current, and the fault phase decision device judging the fault phase of the second differential relay element, executing the rate differential operational based on the second limiting current and electric power system. The first differential relay element corresponding to the phase 1 operates. In case the second differential relay element of the respective 2 corresponds to operates on moreover, the phase 1 and the third the fault phase decision device determines because malfunction occurred in the phase 1."
2020,"The protection control device comprises the output circuit outputting the command signal for opening the breaker based on the control signal from each of the first &#x0223C; third protective relay, executing the protection calculation of protecting the electric power system and the first &#x0223C; third protective relay. The output circuit comprises the first &#x0223C; third circuit which each other is parallel-connected. In case at least 2 among the first &#x0223C; third protective relay operates one side among the first &#x0223C; third circuit outputs the command signal. In case the or more is generated in the first protective relay in case at least one among the second and the third protective relay operate any one among the second and the third circuit output the command signal."
2020,"(Modified U) without the need for power to support the operation display, also provide a protective relay which is capable of supporting the operation display does not have a particular electronic noise countermeasure cost required for the protective relay, which comprises a conventional magnetic reversal display of do. The protective relay is provided with an operation display section 2 to display the operation history. The operation display section 2 includes a first movable part which is provided can be changed between two positions on the lower side 4 is the relative position with respect to the main body portion and the body portion than the first position and the first position. Either one of the main body portion and the movable portion 4 having a magnet 5 to generate a magnetic field, and the other end has an iron core 6. Operation display unit 2 has a coil 7 for generating a magnetic field in the direction opposite to the direction of the magnetic field that causes the magnet 5. Operation display drive for controlling the winding 7 is to control the time becomes greater than or equal to the power system is detected, at least temporarily, to the coil 7 generates a magnetic field in the opposite direction. 6"
2020,"The power conditioner 100 includes a power system (1) and the DC bus (2) DC / AC converter 3 and the electricity storage portion disposed between and converts the DC power of the power grid AC power and the DC bus of the two-way (101 ) battery (4) with the connecting portion and the DC disposed between the bus and converts the DC power of the DC power and the DC bus of the battery to the bidirectional battery communication control unit (6, having a DC / DC converter 5 and the battery portion which comprises a) and a communication control and communication unit 7 and the control power supply section 102 for supplying power to the communication control section for, and the control power supply section is converted into electrical power for supplying the DC power stored in the sub-power storage unit 10 and the power storage to the communication control power source 8 and provided with a backflow preventing part (9) for preventing the back flow of accumulated electric power to the power storage unit and the communication control unit batteries communication control unit and the communication in case of falls to a value of the input voltage of the control power supply unit fixed to a year to stop the operation of the battery."
2020,"Thereby preventing malfunction of protective relays due to the foreign field. The signal of the object to be measured at the power system side of the primary of the first transformer secondary 12_1 is input from the protective relay 4. The signal from the second transformer secondary power system side of the first 12_2 is not input. Correction calculation unit 40 is to remove the influence of the induced current caused by the foreign magnetic field, by a second output signal of the secondary side of the transformer secondary 12_2 I¥å correct the output signal Iz in the secondary side of the first auxiliary shift converter 12_1. The relay operation unit 41 using the output signal (Iz-I¥å) of the secondary winding of the first transformer secondary 12_1 after the correction by the correction calculation unit 40 and the relay operation. 3"
2020,"Thereby reducing the cost and burden of the user in the adjustment of the power consumed by the electric device. Acquiring measured values ??in the control unit 2, unit 210 obtains the measured value of power supplied from the commercial power system Jiro demand. Adjustment command transmitting section 240 transmits a command to adjust the power consumed by the electric device 7. If there is more than allow a measured value obtained by the measurement value acquisition unit 210 to the electric device 7 values. Reception unit using the information on the electric device 7710 accepts an input of the usage information regarding the use of the electric machine 7. Adjustment instruction receiving unit 720 receives the adjustment instruction transmitted from the second control device. If the power adjustment section 750 receives the adjustment instruction by the adjustment instruction receiving unit 720, and adjusts the power consumed by the electric device 7 in accordance with the use information captured input is received by the reception unit 710 using the information. 4"
2020,"While having the flexibility of the degree of design provides for a power system protection and control device with a programmable logic controller function it can be excluded as much as possible the real design. Protective control apparatus main body 10 has a logical operation processing 77 to the logical operation processing on the input signals from the plurality of protective relay computation result, and external features. Logical calculation processing 77 calculates, based on the logic circuit design data produced by the terminal apparatus 60 and the logical operation processing. Logic circuit design data comprises a plurality of basic logic circuit design data that represents the circuit diagram of the basic Japanese logic circuit to be processed in sequentially. Each basic logic circuit that would generate a single intermediate output signal by logic operation to the input signal of the p pieces (p is an integer of 2 or more) at the maximum. Wherein the second basic logic circuit of the second and subsequent may utilize the already computed intermediate output signal as the input signal. 2"
2020,"This invention provides a gas turbine power generation equipment adapted to prevent step out of an electric power generator due to a system trouble such as a momentary power failure in a local grid including intermittent renewable energy generation equipment and the gas turbine power generation equipment.The gas turbine power generation equipment 10 that supplies electric power in cooperation with the intermittent renewable energy generation equipment 30 in the local grid 50 interconnected to a power grid 7 includes: a fuel flow control valve 201 that controls a flow rate of fuel supplied to a combustor 2; a bleed valve 105 or inlet air flow control valve 100 that controls a flow rate of air compressed by a compressor 1 and supplied to the combustor 2; and a control unit 400 configured so that if voltage on the power grid decreases below a threshold V(t), the control unit outputs a control signal to at least one of the fuel flow control valve 201, the bleed valve 105, and the inlet air flow control valve 100. The control unit 400 thereby reduces instantaneously at least one of the fuel flow rate and the compressed air flow rate. After an elapse of a predetermined time, the control unit 400 instantaneously returns the reduced flow rate to its original level."
2019,"This invention provides a gas turbine power generation equipment adapted to prevent step out of an electric power generator due to a system trouble such as a momentary power failure in a local grid including intermittent renewable energy generation equipment and the gas turbine power generation equipment. The gas turbine power generation equipment that supplies electric power in cooperation with the intermittent renewable energy generation equipment in the local grid interconnected to a power grid includes: a fuel flow control valve that controls a flow rate of fuel supplied to a combustor; a bleed valve or inlet air flow control valve that controls a flow rate of air compressed by a compressor and supplied to the combustor; and a control unit configured so that if voltage on the power grid decreases below a threshold V(t), the control unit outputs a control signal to at least one of the fuel flow control valve, the bleed valve, and the inlet air flow control valve. The control unit thereby reduces instantaneously at least one of the fuel flow rate and the compressed air flow rate. After an elapse of a predetermined time, the control unit instantaneously returns the reduced flow rate to its original level."
2019,"A power conversion device which converts power between a power grid and a DC power supply, includes: AC/DC converters for performing conversion from AC power to DC power or from DC power to AC power between the power grid and the DC power supply; a capacitor provided on the DC power supply side of the AC/DC converters and storing DC power; and a step-up unit for charging the capacitor."
2019,"The ground overvoltage relay apparatus comprises the detecting ground fault part (500) detecting the ground fault based on the zero-phase sequence voltage of the electric power system, the minimum value of the line-to-line voltage between the first decision device (100), in which at least 2 of the line-to-line voltage between each 2 phase calculated based on the angular voltage of the electric power system the first threshold this Hara determines whether or not the first condition is established and each 2 phase, and the second decision device (200), in which the rate with the minimum value of the angular voltage determines whether or not as to the second threshold this Hara, the second condition is established and the third decision device (300), which determines whether or not the third condition that the zero-phase sequence voltage is great than the third threshold is established and the lock unit (400) which in case the first condition is established or in case the third condition is the failure while the second condition is established locks the detection output by the detecting ground fault part (500)."
2019,"The failure diagnostic device comprises the first decision device, which determines whether or not the phase voltage is the first critical value under it experiences about the voltage input portion, receiving the input of each phase voltage of the electric power system on 3 and each phase voltage and the second decision device, which determines whether or not the amount of change of the line-to-line voltage is the second critical value under it experiences about each line-to-line voltage calculated based on each phase voltage and the fault phase decision device judging the fault phase of the electric power system. The phase voltage of the phase 1 among three phase is the first critical value under. In case moreover, the amount of change of the line-to-line voltage between the phase 2 among three phase and the third phase is the second critical value under the fault phase decision device determines because malfunction occurred in the phase 1."
2019,"Automatically by the present invention is provided with a top terminal of the communication with the smart meter and each of the power lines of the smart meter which is provided to the respective demand measures the electrical information on the power, and collects measurement information including the measured result of the electric information a management apparatus (5) for monitoring the power-line state in the meter reading system, adjacent and indicating the quality of communication between each other smart meters in the communication quality information and communication quality information indicating the quality of communication between the parent device and the smart meters and the adjacent thereto and a data acquisition for acquiring measurement information from an upper terminal portion 53 and the data acquisition unit acquire the communication quality information, the data analysis unit based on the measurement information at the same time as specified for the demand of the noise source to estimate the time of occurrence of noise ( 51) and a."
2019,"Based on the pre-filled disconnection wiring diagram, it can create a power flow diagram of using the power distribution monitoring and control system automatically. Prewritten disconnection wiring diagram (CAD data 1) to read deulyigo right scanning software 2 and the written symbol data to extract the symbol information of the unit symbol data (symbol table 3) described in-line wiring diagram (symbol table 3) and the pre-signal of the prepared device reads the information (signal table 4) indication from the prepared database 6, the database creation software 5 and written in the system database 6 and registered symbol table for writing 7 and advance for system-wide table 8, the display available power system diagram data 10 as a power flow diagram and a creation system diagram creation software to 9. 1"
2019,"By simplifying the connection between the current signal terminal provides a three-to-out-of-type protection relay device miniaturization is possible. Relay device is housed the first to third protective relay to the case, in this order. Each protective relay is provided with a first terminal 25X, 25Y, 25 Z, including the first group of terminals for inputting 3-phase current signal. The case is provided with a second terminal I 25, including a second group of terminals for receiving a three-phase current signal from the current transformer provided for each phase of the power system. A second terminal group is connected in series with the first terminal group for each protective relay. Each protective relay is a first terminal group a protective relay calculation can be adapted to the phase sequence, and at least one of the polarities of the three-phase current signal into reception is switched in the reverse order by using the three-phase current signal after the replacement with a corresponding. The final protective relay calculation result is determined by the majority processing of the protective relay computation result of each protection relay. 6"
2019,"Hot water heater control system 100 includes a hot water supply device 20 for supplying hot water to the dispersed type power supply (30) at least one electric power to the hot water storage tank 24 is supplied from between the supply for supplying power to a commercial power system and the commercial power system controls. Hot water heater control system 100 instructs the acquisition by the instruction acquisition unit 11 and the instruction acquisition unit 11 for acquiring an instruction to suppress the power supply to the commercial power grid in a distributed power supply 30 of the first time a second time on the hot water heater 20, or if that is not the supply amount of hot water predetermined in the hot water heater 20 to a second time earlier than 1 hour and instruction is acquired by the instruction acquisition unit 11, a predetermined amount to feed a small amount of hot water than that by supplying hot water at a first time, and a control unit (21) for supplying a predetermined amount greater than the amount of hot water."
2019,"In the authentication system having a redundant power system monitoring and control system is a device used to reduce the disablement of the system unavailable for the time when switching to the backup unit. Power system monitoring a first authentication server 110 in the control system comprises for connecting the operation-suspended If we admit the login authentication request received at 301, the first feature server 130 and the operation for authenticating switch 311 suspended 301 through the authentication switch 311 1 at the same time as opening the Sikkim port, and notifies the operation-suspended 301 certified information that authentication is completed in the second authentication server 210 provided on another server base. The second authentication server 210, and requests the authentication to the switch 311 based on the authentication completion information, opens the second port for connecting to a second server function 230 and the operation-suspended 301. 1"
2019,"In the event of an accident of the power system to supply power to only a random sequence with respect to commercial equipment, and also provides a power converter that while minimizing the amount of expensive storage battery, to realize a back up for a long time. Solar cell 1, a DC / DC converter 6. The battery 2 has two-way DCDC converter 7 is connected as soon at the same time, each output of which are connected to the capacitor for DC link in parallel eight power as an input power source with a condenser 8 for the DC link to the grid 3 It has a repellent charge current control type inverter 9 and the voltage control type inverter 10 that measures a power failure the supply the required power to the load commercially 4-42, also includes a controller 5 for controlling them. And it switches the power source for supplying a commercial load 4 in accordance with the supply power amount of the solar cell 1 and the battery 2 by the controller 5. 1"
2019,"In the power conversion device for connection to the power system to stop operation to the sole operation state reliability often well detected promptly. The power conversion device 1 is a switching unit 2 and a control unit 20 and the breaker 5 provided and, in the control unit 20, the power conversion apparatus 1 of a detection signal So delays the judgment signal Soa from the determining section 82 and determining section 82 for determining a single operation the 83 has a delay circuit for outputting based on the duty command from a single operation detector 21 and the current controller 31 and current controller 31 to be provided with a signal generator 32 for generating a PWM signal. Then, the controller 20 controls the switching unit 2 using a PWM signal, and the circuit breaker block 5 by using a detection signal So from the single operation detecting section 21, and at the same time, stops driving the switching unit 2. 1"
2019,"Installing the power system 3 and the power conversion apparatus 1, the connection switch and at the same time linked through 5, the power converter 1 and the associated switch (5), the load (6) demand between the associated switch 5 is provided with associated switch when the demand is connected to a series circuit with for voltage holding load 9 and the load joint switch 10 for maintaining the voltage of the load (6) at the time of system moment still in parallel and instantaneous stop occurs 5, it turns off the power system 3 and the power conversion apparatus 1, the voltage holding a has associated switch (5), connects through for a load (9) and the moment still return onhae power system 3 and the power conversion and controls so as to connect the device (1)."
2019,"It provides a current differential protective relay device capable of accurately determining the accident of the power system with a simple configuration. Current differential protection relay device receives from the accepted inputs of rosewood current through the transmission line other data from a current between the other end of the blood reserve current differential protection relay device between the blood reserve. A current differential protective relay apparatus based on the effective value of the current and the effective value of the other end of the determined result and rosewood current of whether or not the phase difference is less than the reference threshold and the other end of the current and rosewood current to calculate the differential current. A current differential protective relay device is a phase difference of the reference threshold value is less than the case when the effective value of the other terminal calculates an addition value of a current effective value of a differential current and a phase difference based on the threshold value of rosewood current or more, the effective value of the other end of the effective value of the current of rosewood current It calculates a subtraction between the value of a differential current. Current differential protection relay device executes the accident is determined based on the calculated differential current and suppress current. 7"
2019,Monitoring and control device 100 for selecting the first or more of the display control unit 503 and a plurality of at least displaying the alarm screen 300 for notifying the plurality of the above occurred in monitored equipment (2) provided in the power system the selection unit 505 and a plurality of or more of the calculation is also related to the art produce different or more relevancy unit for at least 1 for the other over at least one individual other than at least 1 507 and other more relevance to the threshold or more If in the art and provided with an extraction unit 509 for extracting the other over a longer relevant associated with the first or higher. Alarm screen includes an associated alarm for notifying at least the extracted related.
2019,"Over current relay 30 is lowered to detect the over-current detecting unit 100 and the effective value of degradation of detecting an overcurrent by comparing the effective value and the corrected value of the input current input from the power system detection section 110 and the overcurrent detection unit 100 the detection result and on the basis of the deterioration detection unit 110 the detection result with a predetermined condition related to the input current of the current waveform and an output control unit 130 to generate the operation output and the return output. As when the output control unit 130 decreases the effective value is detected, when the predetermined condition is satisfied it is to create a return output regardless of the detection result of the overcurrent detection unit 100."
2019,"Process according to Protective bus system 40, a first merging unit (50_1) is digital-converted to a first digital value to continuously samples the amount of electricity of the power system. An intelligent electronic device (60) produces a first digital value corresponding to the time-series data reception time specified by the first digital value received time received from the first merging unit (50_1) in a process bus (41). An intelligent electronic device 60 determines the amount of electricity values ??sampled by a first merging unit (50_1) according to any claim 1 time of the basis of the first digital value, the time-series data of the first delay time information corresponding to the reception time ."
2019,"Provides a server system which can more properly control the connection to the art terminal device and the server according to the first degree user of the terminal device provided at the operating base. Server system for monitoring the power control system is provided with a management apparatus that manages the server and the terminal device and the connection to the server for generating display information displayed in the terminal device. The management device based on the user information included in the connection request to the server and specifies the degree of the first user and to control the terminal device and the connection to the server of the connection request source. The management device is empty, if the server is not present, extracts the user priority than lower priority is assigned to the user of the terminal apparatus of the access requesting source from the user of each terminal device which is connected to each server and corresponding to the extracted user the terminal device and the connection to the server to thereby cut and connected to the terminal device of the connection source that is cut server connection request. 4"
