A,abstract
2013,"The protective control system is provided with the merging unit and IED (Intelligent Electric Device). The merging unit has a current input, a voltage waveform signal from the power system and outputs the serial signal as a process bus to the communication line for analog data after digital conversion. IED is configured to transmit a tripping command for outputting a trip signal for the merging unit by both of the process bus and the station bus. Preferably, upon detecting a merging unit and the IED is over the process communication bus include a respective switching circuit to switch to the station bus. And when more than the process bus is replaced by a communication bus to a process station bus. It is possible to improve the reliability of the process by the bus."
2013,"To add the functionality of the remote control software in the minor number in protecting control system that runs the protection and monitoring and control of power systems. Protective control apparatus 11 has started operation to install the remote control allowance button to switch the state prohibiting state with a remote control that allows the remote control 17 and determine the control functions of the HMI screen 41, the protective control apparatus 11 built on PC26 button 42, the Web server 60 of the installation and the protection control unit 11 is notified remote control, the allowance button 17, the remote control authority or information on the remote control forbidden characters by the selection operation is set in a device of the Web browser 62 of the PC26, the Web browser 62 is a control for switching the operation whether the operation start button 42 on the basis of information on the remote control and the remote control permission or prohibition to the void effect. 4"
2013,"To get a digital type protection relay having a configuration capable of preventing, without requiring the user with a particular data set recorded at the time of power system fault is overwritten by the recorded data at the time of test operation to be erased. Storing section 1 provided the operating Application conserved region 1 a and a working test trial conserved region 1 b written in the destination determining section 3 determines whether the operation Shi or operation test admitted to the monitoring of this power system timing consisting of a collection of history data management when the seal stores the write data collection unit records data that has been collected in the second storage area 1 a trial operation, and when the operation test seal stores the write data records data collecting unit 2 collects the operation test trial conserved region 1 b. 1"
2013,To get the distance relay apparatus capable of speeding up the operation time. Calculating the impedance using the voltage and current input from the power system and on the basis of the impedance for calculating the distance to the accident point distance computing section 1 and the voltage displacement and incident representing voltage and incident voltage and the difference between the subsequent occurrence of an accident prior to the current and on the basis of the current displacement indicating a difference between a current and after the accident occurrence to determine whether or not the accident that the at Do on the basis of the direction operating section 2 and calculating the distance and the direction for calculating the direction of the accident point predetermined reserve Uchi and a determination unit. 3
2013,"To obtain a control method for an elevator and a system to prevent the reversed current to the power system by the regenerative power generated at the time of regenerative operation of the elevator occurs. By an AC power from the inverter 11 and the inverter 11 to convert direct-current power obtained by smoothing the converter 18 and the DC power converter 18 for converting the AC power obtained from the AC power source to a DC power capacitor 12 and the capacitor 12 into AC power and a driving pattern controlling means 26 to limit the running speed or deceleration of the electric power detecting means provided immediately before the short-term parking 19 of an AC motor 5 for driving the elevator cage and the building 125 with the basket 1. And the electric equipment detects the total amount of power consumed, and the power consumption is negative, that is, the driving pattern controlling means 26 so that the reversed current of the power system to generate the traveling speed and deceleration of the basket 1 of a building by the power detecting means 25 limit. 1"
2013,"When the discharge function or communication function of the charge-discharge control device turned not even at the same time as preventing the disadvantage in the user resulting from the secure on-vehicle battery of the electric vehicle a predetermined amount, to secure the convenience in user which provides a charge-discharge control device. Monitoring and control device 15 if it is based on a charging instruction or discharging instruction is given from the outside to control the charging device 11, discharge device 12 and the charge and discharge switching device 13 and executes the charging and discharging modes to charge or discharge the electric power of the vehicle-mounted battery 31 the information given by the detection from the discharge device 12. when detecting the loss of the discharge function, the process moves to a charging mode for performing only the charge in the charge and discharge mode. 1"
2012,"Power quality (PQ) events in a waveform in a power distribution network are detected by sampling the waveform. For each sample, a normalized sample is determined by subtracting an undistorted waveform from the sample. An accumulated weighted log-likelihood ratio (LLR) is determined for all normalized samples, as well as a minimum of the accumulated weighted LLR. If the difference between the accumulated weighted LLR an the minimum LLR is greater than a predetermined threshold, then the PQ event is signaled. The network can be a smart grid."
2012,"A control method for a wind turbine generator and storage battery unit connected to a power grid in parallel, includes calculating total active power and total reactive power, and switching between: a first mode in which the generator outputs turbine required active power and reactive power that can be outputted by the generator and the battery unit outputs battery required active power and battery required reactive power which correspond to a difference between the total active power and the turbine required active power and a difference between the total reactive power and the turbine required reactive power respectively; and a second mode in which the battery required active power is maintained and the battery required reactive power is reduced while the turbine reactive power is increased by an amount of the reduction of the battery required reactive power wherein apparent power exceeds a set battery unit apparent power."
2012,"The present invention is to provide the differential current protect realy which restrains utmost the degradation of the dynamic sensitivity and in which there is no malfunction even if moreover, the CT conduction to the percussion marks is generated. As the means therefor, the activation amount and inhibitory dose are computed by using each terminal current (the I1 to 1n) from the multiple current transformers prepared in the angular of the electric power system. It is the current differential protective relay (1) performing the protection of the electric power system based on the activation amount and inhibitory dose. It the primary side of the current transformer on the person accompanies in the flowing current and the flowing induction (KH) is produced based on the effective value of each terminal current (the I1 to the In) on the person in the secondary side of the rudder top cloth current transformer and the inducing current information output unit (20) outputted to the rudder top cloth current differential protective relay (1), and the sensitivity controller (21) controlling figure of merit desired value (K91) of the low current domain of the current differential protective relay (1) on the person based on the induction (KH) from the inducing current information output unit (20) on the rudder are included."
2012,"The invention relates to the reference voltage it is the voltage of the electric power system degraded with the system accident etc. ascertained. And done by the purpose to make turn around. It was the power plant equipped with the generator connected to the electric power system, the voltage detecting portion detecting the voltage of the electric power system (2), and the controller (21) determining the reactive current according to the voltage. And when it passed with predetermined time since the voltage of the electric power system changed over the predetermined amount the voltage of the electric power system includes the information conversion unit (22) which changes the voltage-current related information so that amount of the reactive current about the amount of change of the voltage of the voltage-current related information be enlarged in the case which there was no within the range of the predetermined predetermined. The controller (21) determining the reactive current according to the voltage acquires from the voltage detecting portion (27) based on the voltage-current related information corresponding to the reactive current which supplies in the voltage and electric power system (2) of the electric power system (2) and controls the electric power converting section (20) in order to adjust the reactive current which absorbs in the electric power system (2) from the supply or the electric power system (2)."
2012,"The invention relates to the purpose the damage of the electronic device type is prevented it is installed at the cold climate area. And it does. The power unit (23) connected through opening and closing switch (3) with the electric power system (10), the system voltage measuring unit (26), and the temperature measurement part (21) for saving the ambient temperature of the power unit (23) are included. It is smaller than the first temperature critical value in which the ambient temperature of the measured value of the temperature measurement part (21) or the power unit (23) presumed based on the measured value is determined based on the function assurance temperature of the power unit (23). In case the voltage measured with moreover, the system voltage measuring unit (26) becomes smaller than the predetermined voltage threshold since opening and closing switch (3) operate the wind power installation (2) in which the connection of the electric power system (10) and power unit (23) is blocked is provided. The system voltage measuring unit (26) is installed between the power unit (23) and electric power system (10) and measures the voltage of the electric power system (10)."
2012,"It is done by the purpose to reduce the output change in the tie point. The driving control method of the wind power generation system including a process of acquiring output data of each windmill, a process of saving the correlation of the output change of the windmill, and a process of diversifying the phase of the output change of a one-way among the windmill is provided. A process of saving the correlation of the output change of the windmill is adjacent by using. A process of diversifying the phase of the output change of a one-way among the windmill is adjacent to the periodic time when the strong correlation makes an appearance in case the strong correlation makes an appearance."
2012,"[Subject] In the direct-current component as to the system event occurrence time is the flowing case, over current relay doing the high speed return with realization possibility is obtained. [Means for solving problems] The excess current decision device (40) outputting the first return signal returning the CB (2) from the open state to the closed state, current return plate positive and negative (50), and the return controller (60) are included based on the effective value (Irms) and decision value (Is). Current return plate positive and negative (50) remove the direct-current component included in the current I and after it performs the emergency processing diversifying the phase from which the direct-current component is removed of the current I0 and it produces the current I1 after the emergency processing to the I3 output the second return signal returning the CB (2) based on the current I1 after the current I0 of the emergency processing former and emergency processing to the I3 from the open state to the closed state. The return controller (60) stops the operating signal of the excess current element when any one between the first return signal and the second return signal are input."
2012,", The power storage device is output to the excessive charging or not transition over discharge while effectively utilizing the power of the power storage device within the range of the filling factor distributed power supply system as a whole power system by the first that controls the power supply to the system than the protection object of the power storage device to effectively perform. The controller 13 together with the setting of power generation output and the target supply electric power based on a state of charge of the power storage unit 11 of the distributed power supply 2, and the fluctuation rate of this has allowed the fluctuation rate of the target supply electric power when there get out of the predetermined allowable power fluctuation rate range a first setting section 21 and a second setting unit 22 for setting the converter target power from the target electric power supply, and the allowable power fluctuation rate range for suppressing into the power fluctuation rate range according to time, load, the filling factor of the environment, or the power storage device 11 provides power storage device 1 is changed. 1"
2012,"1 synchronously to the PPS signal 42 generates a sampling signal 32 a and the sampling signal 32 a is to be up in the cyclic count each time when a data number 32 b and the control signal output for outputting the sampling signal 32 a as the control signal 21 a circuit 21 and the control signal on the basis of a control signal 21 a from the output circuit 21 and a data output unit 50 for outputting by converting the strain amount of electricity to the digital data 15 a, the control signal output circuit 21 is a second clock number P1 and the third clock can clock number calculation circuit to obtain the P2 38 and the first year of clocks calculated by P and the second difference between the clocks P1 on the basis of the difference with a third clock number P2 control the period of the sampling signal 32 a sampled signal 32 the generation timing of a 1 and a synchronization control section 39 for synchronizing the PPS signal 42. 3"
2012,A generator with an output power signal that prevents the expansion of the power variation which is generated between the electric power system without giving disturbance to the power system to be able to continue a stable operation indicating the output power command value signal with the current value of the output power command value and the current value deviation detection means for outputting a deviation signal representing the deviation between a 1 and a control means 3 and the output power signal to a deviation signal input as an output to the control output signal for controlling the output of the prime mover as an input the output of the prime mover from the input signal and the output power and output a predetermined by a advances the phase of the input signal as an input to change detection means 7 a and the frequency components extracted output a frequency component or the shifted correction signal by a periodic variation of the output power generated by the mismatch which it is characterized in further comprising an adding means 9 a which adds the correction signal to the phase adjusting means 8 to a control output signal. 5
2012,"A surge protector at the time of resuming operation of the electric power conversion system in a state of a voltage imbalance of the power system, and at the same time, makes it possible to resume operation at a high speed while suppressing the overcurrent. A first operation threshold value Vth1, the atmosphere dead overcurrent suppression with ¥Õth1 115 and a second operating threshold value Vth2, provided a surge protector dead air 116 having a ¥Õth2 and to Vth1> Vth2, the amplitude variation ¥ÄVa ~ ¥ÄVc, phase deviation ¥ÕVa ~ ¥ÕVc one is Vth1, when it exceeds Vth2, by the power conversion circuit corrects the voltage command value of 1 Va * ~ Vc * and controls the power converting circuit 1 with a signal of the pulse width modulator 107 for inputting the correction value, the voltage of the the voltage amplitude is suppressed to suppress the over-current is over. 1"
2012,"Accident phase current value bakkwieodo largely by power lines or accidents that can also prevent unnecessary responsive due to an accident, even, progression-over-rich in sound the distance relay other than the incident without these effects involve the arc resistance and also to get the distance relay apparatus that enables an accurate determination of the Drawing and highly reliable accident display of the shedding commands for the three-phase accident. Three distance determining circuit that the accident of the operation duty range in one of the nine distance determining the two-phase and three case-determining circuit 16-1 if the second phase the same sangil represent the minimum impedance value determined in one of 16-3 or 3 two distance determining circuit 9 is determined that both the distance of the accident operation duty range, the three-phase equivalent to the decision circuit 17 outputs the operation to the third when in the acceptable range of impedance values ??on the operation judging unit 6 outputs a reference block 25. 1"
2012,"By making it possible to facilitate the various operations of the power system control system prevents an erroneous operation and avoid the malfunction of the system. Provided with a man-machine interface 1, a human during machine interfaces set up the system by operating the first guidance for selecting the display of the system recovery operation guidance when a defect occurs in the power system control system for management fee button 132 and defects System Recovery If the the display unit 11 to display the contents of the operation guidance provided in the man-machine interface 1 to the guidance of button 13 is operated at the time of system failure, a recovery operation method required for the defect region, defect causes, system recovery is displayed on the display unit 11 power system control system, characterized in that. 1"
2012,"Even if in the digital protective control apparatus for the protection and monitoring and control of the power system that are input and output board it is not mounted on the chamber unit, to enable the efficient conduct of the test, such as for the real device. A digital protective control apparatus connected to the first operational digital protective control having an input-output unit 20 to the input processing of the information from the control command output process and the external device based on the operation result of the operation unit 10 and operation unit 10 to the protective control operation a test device of the support device and has an input and output to simulate a part or the whole of the substrate input and output 18-a, b, 19-a, b to be mounted in a simulated input-output unit 20 3. The input and output simulation unit 3 in which it is stored the unique information of which input and output substrates corresponding to the substrate and the substrate address as the address information indicating a mounting position of the substrate input and output of at least input-output unit 20 as a material for the substrate of the input and output. 1"
2012,"Even if there is a variation in the closed extreme operating time and pre-arc time of the circuit breaker and provides a driving control device that can be as short as possible a period of a woman in the transformer inrush current flows. The control unit 80 of the breaker 10 are input the current in the R of the circuit breaker 10 to the timing at which the residual magnetic flux of the first In-phase (R phase) matches the top flux. Thereafter, the controller 80 determines whether the current measurement section 40R, measuring current of the 40S, 40 T exceeds the threshold value. Control unit 80 is input to a (phase S-phase, T) than the rest of the circuit breaker 10 to the timing at which the voltage on the R-zero if the measured current does not exceed the threshold. If the measured current exceeds the threshold value, the power again after the end cut off the current on the breaker 10 R. 1"
2012,"For its object to compensate for the power difference stored in each cell and provides a power compensation device, which can improve the utilization ratio. Having the compensated power storage unit and the cell power modules U1 ~ U4, with the single-phase inverters V1 ~ V4, W1 ~ W4 for storing the electric power, and is made by connecting a superconducting coil as the power storage unit to the DC power side of the single-phase inverter line voltage of each phase is to maintain a balance was provided with the inner power controller 5 for controlling a rate of each cell power module of the power in each of the upper phase power controller for the power control of the above 6 to each phase. 1"
2012,"It may unify the connection of each of CT on the Y connection to get the transformer protection relay that can perform phase correction with respect to all of the plurality of windings of the transformer approach with (inner wiring). CT2,3 imparts 4 in a Y to extract the grid current of the transformer 1 by wiring the transformer protective relay, respectively. Transformer protection relay 4 a can and a non-conversion process to the three-phase current differential current conversion to simulate the connection of the current converter 12 CT in the ¥Ä connection, and simulate the connection of the current converter 22, a CT in Y connection, phase correction section 23 is 30 a is also not, for a shift process set only by the user and carried by the current conversion corrector 7 and a fixed phase correction value setting device 8 as a relay correction, the primary current and the secondary current it is possible to match the phase. 1"
2012,"More than any state or behavior continued state provides digital protection and control device that can verify the information you need without having to constantly check maintenance worker a button. Bring the amount of electricity of the power system protection for the power system by a protective operation based on the quantity of electricity, control the digital protective control apparatus and a screen for displaying the display device and the circuit for displaying a plurality of screens that an inspection work of the power system previously registered to the cycle setting section (registration screen) 19 and the registration screen to schedule and to switch sequentially provided with a display section 20 for displaying on the display device circuit. 2"
2012,"The method of voltage compensation apparatus load is to have a large capacity of the condenser, when it is closed the bypass switch (first switch) at the time of start-up, that a large current is energized to charge the capacitor to the contacts that make up the by-pass switch (switch) prevents. Year of load maneuver disconnect the inverter 9 in the power system 1, and a second switch 8 which can be connected in parallel to the load 2, by the soft-start outputting a voltage to be applied to the load 2 by the inverter 9, the first switch 7 suppressing a rush current to the contacts and to prevent the welding of contacts. 1"
2012,"The present invention uses the frequency of the measured real-time high accuracy is obtained for each phase component current-voltage instantaneous value estimated time-series data to the minimum square method. The instantaneous voltage and current values ??using the time-series data to estimate the voltage effective value, the effective current of each phase component and symmetrical component, an instantaneous real power values, reactive power instantaneous value, obtain the effective value of active power, reactive power effective value. The application of the measured flow of electricity for all power system control protection."
