A,abstract
2015,"Main inverter 5 with a DC voltage is relatively low sub-inverter 7 and the AC through the series-connected to order the way back of the drive unit for the electric power conversion system that link to configure the 10 power from the dispersed power source 1 to the power grid 15, the grid voltage VA continue to reliability often well during operation. The main inverter when the grid voltage VA Top 5 outputs the voltage of the first pulse in the half period matched to the grid period and the sub-inverter 7 by PWM control, and controls the drive current i and the command value of the voltage Vs of the sub-capacitors of the sub-inverter 78 to thereby follow. If the net cost occurs, the inverter unit 10 switches the control mode of, and a sub-condenser 8 of the sub-inverter 7 by-pass and increases the DC voltage Vm of the main inverter 5 than the maximum voltage value Vp at the time of the grid voltage VA normal main inverter 5 by the PWM control, and it continues the operation also to control the drive current i, even when returning to the grid voltage VA when the low order. 1"
2015,"More safe and smooth transition to the independent operation supplying energy efficiently. In the energy management system to manage the building of the power measuring unit 6 measures a state value indicating the state of the environment of the building. Controller 2 is acquired by the indicating appliance state installed in indicating the power storage system state provided in representing the development of the system state provided in the measurement condition value and the building state value and the building state value and the building state value each communication controls the instrumentation and power generation systems and storage systems, and appliances. The controller 2 sets the frequency of communication for acquiring the respective state values, depending on whether power is supplied from the outside to the inside of the room. 1"
2015,"My home power system having a distributed power system safely in conjunction with a commercial power system. Assure that the commercial electric power system blackout one after the primary voltage V1 and the secondary-side voltage V2 of the block remote breaker 32 is rated at the voltage recovery at. And the primary voltage V1 and the secondary-side voltage V2 in the electric power system assumed by operating the contactor 33 when the both is the rated voltage is associated with a commercial power system. By recovering from the commercial power grid blackout Consequently, this being achieved without the user is within the power system prior to take-home charging noticed. As a result, the user is assured of safety. 2"
2015,"Operation can be continued even if there is such instantaneous voltage drop occurs in the power system voltage, and after the recovery of the power system provides a power system for a power converter that can be linked back to the normal operation at a high speed. First an inverter 3 and the series connection of the second inverter 4 to the AC signal of the first inverter 3, and the second inverter 4 are PWM control the output voltage and the difference between the output voltage of the first inverter 3 to the electric power system 7 intended to output from the case normally it is operated can not control the bus voltage V2 of the second inverter 4, a second inverter 4, the charge and discharge the capacitor 5 according to the polarity of the output current of the power system 7, to maintain the bus voltage V2 an AC output and a first inverter to which a voltage waveform 3 is PWM controlled to output the output voltage and the differential voltage between the output voltage of the second inverter 4 to the electric power system 7. 1"
2015,Possible to suppress a decrease in operating sensitivity also may be a CT guided to the tasang it occurs to obtain a current differential protection relays there is no malfunction. Calculating the amount of restraint IR1 atom of induction inhibiting amount KH that it involves a current flowing through the CT 1 primary side control the amount of restraint IR1 of the calculated tasang using the current In induced on the tasang CT 2 primary side based on the stab inhibiting amount computing unit on the basis of the induced suppression amount calculating section 81 and tasang the induction inhibiting amount computing unit derived inhibiting amount of KH and the inhibiting amount IR1 of stab output 81 of which for computing inhibiting amount of IR which is used in the ratio differential operation of the stab 61 It includes a. 2
2015,"Prevent fraudulent use and for the purpose of obtaining a power system monitoring and control system capable of monitoring and control using a general-purpose terminal. The portable terminal 11, the transmission means 105 and 106 for transmitting the location information at the time when received the position information acquisition unit 104 and the input operation for acquiring the location information, when an input operation with the control code according to an input operation with the main controller 21 installed and the main controller 21 is operational, which are read the operation area of ??the device corresponding to the maintenance monitor control operation region information for holding the information indicating an operation permission region of the device, third means 201 as the received control code, read area and control operation of the transmitted position information with the control condition code is provided with a control means 202 and the operating condition monitoring and control device 205 to run the monitoring and control based on a matching result by the matching means 202. 1"
2015,"Process bus Protective system includes a process bus (6A) and a plurality of MU (Merging Unit) (5_1,5_2) (a) and (Intelligent Electric Device), a plurality of IED (7_1,7_2,7_3) (a). Each MU samples the current and voltage of the power system at a timing synchronized with the time synchronization signal received over the process bus. Each IED is configured to be self is the transmission source outputs a time synchronization signal to the process bus. Each IED may be receiving the other IED is the source transmission time synchronization signal through a process bus. The IED has a plurality of first rank is predetermined. Each IED is party does not have a high priority than the IED IED receives the transmission source, the time synchronization signal itself is the transmission source is configured to output the time synchronization signal to the process bus."
2015,"Quickly determine whether to limit the loads at which the harmonic generation, and provides a system and method for power system monitoring and control system of the power system that can quickly reduce the effects of harmonics. Voltage distortion rate calculating means to calculate a voltage to the distortion rate based on the detection value of the voltage detecting means 26 by a 32 based on the detection value of the current detecting means 25-1 ~ 25-M by the means for calculating harmonic current power each strain 33 the relative ratio of the supply lines 23-1 ~ 23-M calculate the deformation of the harmonic current and voltage distortion rate exceed the first threshold time value, the control means 31, each of the power supply lines 23-1 ~ 23-M by the harmonic current transformation estimating on the basis of the load by the voltage transformation and to interrupt the power supply to the part load and the sum of the modified voltage estimate of the movable load lower than the first threshold. 1"
2015,"Renewable energy power generation device (such as a wind power generation apparatus) is provided with a hydraulic transmission including a hydraulic motor, which drives a generator for supplying power to the hydraulic pump and the power system is driven by a rotating shaft connected to the rotor. The transmission controller is a torque limiter to limit the torque generated by the hydraulic motor in order to prevent, for example lowering of the generator terminal voltage due to the accident or the step-out of the generator caused by the drop in the field strength of the hydraulic motor, It includes. The renewable energy power generation device has the effect that even with the generator directly connected to a power system, can avoid the danger of step-out during operation. 1"
2015,"The digital protection relay 10 has an input conversion unit and the analog / digital converter 15 for converting an analog signal to a digital signal receiving a signal representing the amount of electricity of the power system as an analog input circuit as an analog signal. Digital protection relay 10 performs the protection operation on the basis of a digital signal, the analog / digital converter 15 is converted by the operational and control section 16. Operation control unit 16 is the timing of the input data 71 is converted into a digital signal by the protection operation unit 61 and the analog / digital converter 15, which details the protection operation using the offset voltage is 74 sampling depending on the acquired input data to obtain the sequential portion (2) and based on the difference amount between each sampling value, an offset for calculating the offset voltage value based on the sampled value of the period of time that the input data of the difference amount polarity in at least one cycle change functions as a value calculation unit 65. The"
2015,"The invention is inclusive, the present invention relates to routing of packets in a network of smart meters with a particular link failure relates to routing of packets in a wireless sensor network. A broken link in a sensor network is avoided by expressing the network as DODAG. The rank associated with each node defining a relative position of each node in the other node, and the rank is the type of jinbunsu rank of each node is never increased in order to enable a loop-free routing."
2015,"The test apparatus 50 tests the protective control unit 20 of the power system. PC (60) will perform a simulation operation of the CT and PT based on the characteristic of a transformer for instruments for the voltage waveform data (PT) of the current transformer (7), the current waveform data (CT), the instrument transformer 8 for the, based on the characteristics of MU (10) generates the fault data by executing a simulation operation of MU (10). The test apparatus 50 acquires the device information data (DI) indicating the circuit breaker of the power system in synchronism with the fault data. The test apparatus 50 is transmitted to the failure data and the device information data protection control device 20 a (DI) via a process bus (22) depending on the setting of the setting of the sampling of the data output process to the bus 22."
2015,"To an error occurs in the external electric power system, even when the required load suddenly changes, which enables the normal operation control, and that for the purpose. Combine de generation system 1 is a combustor 9, a gas turbine 11 and the external electric power system having a generator 13 to 51 supply electric power to the gas turbine system 3 and the fuel gas and air is supplied developed power in the power generation SOFC body 15 and the SOFC body 15, which the SOFC includes a system 5 with the inverter 53 for supplying the external electric power system 51. Also combines de-power generation system 11 when a detection of an external electric power system 51, a generator 13 and an inverter 53. The secondary battery 52 and the above system for detecting the abnormality of the external electric power system 51 detecting unit 58 and the system error detection unit 58, the grid or more connected to the switching unit for switching the power supply of the generator 13 and the inverter 53 from the external electric power system 51 to the secondary battery 52 50A, 50 B and a. 1"
2015,"To get the possible protection relay applied to both the single-phase three-wire circuit and a three-phase three-wire circuit. Protection relay according to the present invention, the result of determination by the determination section 3 and the determination section 3 determines whether the type of the power system based on the relationship between the current phase and voltage phase of the power system corresponding to any of single-phase three-wire and three-phase three-wire an arithmetic processing corresponding to the three-phase three-line power system when the result of determination by the single-phase three-beam operation unit 5 and the determination section 3 to the operation processing corresponding to the single-phase three-line power system in case a single-phase three-wire, three-phase three-wire, the three-phase insulating operating section 6 includes a 3 to. 1"
2015,"To obtain a protective relay system which can improve the reliability of the redundancy to the input transducer unit system. IED5 a case when an abnormality is detected in the input converter in a plurality of input transducer tank, is more than the second digital data and at least from the input transducer is not an abnormality is detected on behalf of the first digital data from the detected input transducer is detected not using the first digital data from the input transducer should have a protection operation of the power system. 1"
2015,"To obtain a protective relay system with the data transmission efficiency can be improved. Transmission frame to read B1 ~ B3 electricity quantity of the input and outputting to a set of data Xt in the electric quantity acquiring unit 1-3, and each transmission frame is stored in the housing case B1 ~ B3 in the second data (Y0, filter data Y1, car equal amount such as data Z0) for generating and frame B4 ~ B6 and to generate, based on the frame B4 ~ B6 transmitted from the data pick-up device 9 and the data pick-up device 9 which outputs to set the second data in the frame B4 ~ B6 power system It is provided in the operation unit 6-8 to the protection operation. 1"
2015,To prevent the frequency of resumption of the stopped charging and discharging based on the voltage drop by the internal resistance. Usually during the charge and discharge control unit 155 is a charging and discharging of the rechargeable battery 140 voltage with a predetermined electric power system and the water supply to convey power in the case does not reach a threshold value so as to satisfy the predetermined condition. Emergency charging and discharging control unit 156 is charging and discharging of the secondary battery 140 to the same voltage as the art threshold if there is a voltage of the secondary battery 140 reaches a predetermined threshold value. 1
2015,"To provide a non-grid power supplied from the power grid of the power supplied by the public and non-public power grid of the charging of the vehicle. Comprising a charging management unit 110 for managing system power and the non-system one or more of the charging device 130 and the charging device 130 has a charging function for at least a system power of the power provided to the charging of the vehicle, and the charging management apparatus 110 is a predetermined range area, depending on the relative size of the demand for the supply of system power of the a ~ C of to vary the power provided by the charging of a vehicle of the system power and non-grid power, the charging device 130 in the art area a ~ C It has a control unit for controlling the charging device. 1"
2015,To suppress the variation of the power output to the power system within a predetermined range and also quick access to the target charging rate charge rate of the secondary battery. Smoothed power calculation section 142 based on the generated power of the power generation unit 110 calculates a smoothed power of the power after smoothing of that generated power. Adequacy power calculator 144 calculates the charging rate adequacy power the forging ratio increases for the current charge rate of the secondary battery 130. Charge-discharge control section for charging and discharging the power difference of the smoothed power and power to the secondary battery charging rate optimization. 1
2015,"While charging the generated power by the solar cell to the battery is an object of the present invention to provide a power storage type power generation system which can be reversed current a surplus power. Power storage to electric power from the electric power and the system 40 by the power conditioner 19 and the solar cell 10 associated with the external system 40, and a storage battery 60 to discharge, a reversed current advanced surplus of electric power by the solar cell 10 to the grid 40 a solar power system 1 that may, provided, and the battery discharge detection circuit 30, the ground the reverse power relay 25 for detecting that toward the battery-discharge detection circuit 30 and a system 40 for detecting the discharge from the secondary battery 60 caused a reversed current the when detecting and the reverse power relay 25 while detecting the reversed current, with the opening of the power conditioner 19 stops, haeryeol relay 24 cut off the connection with the grid 40, the inverse of the system of the electric power discharged from the battery 60 to 40 prevents algae. 1"
2014,"Broken links in a sensor network are avoided by representing the network as a DODAG. A rank associated with each node defines a position of each node relative to other nodes, and the rank is in a form of a proper fraction, and the rank of each node never increases to enable loop-free routing."
2014,"An operation channel in a multi-hop network is determined. The network uses a set of channels, and one of the nodes is a network management node. The operation channel is selected in the network management node. Then, the network management node broadcasts a channel information packet including the operation channel using all channels. The channel information packet is received in each of other nodes, either directly from the network management node or from an intermediate node that received and rebroadcasted the channel information packet. Lastly, the operation channel in each node is set according to the channel information packet until the network is formed."
2014,"2 even if during the observation in the state estimation calculation of the second and subsequent redundancy lowered, in order to get the state estimation calculation apparatus which can without deteriorating a degree of calculation conditions largely calculate the state calculated degree of the high state estimation calculation than the conventional do. And at the same time based on the system data input unit 14 and the system data to input lines of data create a node branch model of the power system 2, a partial differential created by the model creating section 11 and the model creating section 11 to create a partial derivative matrix based on a model using the matrix comprising the calculation result storage unit 13 for storing the results computed by the state estimation calculation section 12 and the state estimation calculation section 12 to the state estimation calculations, modeling unit 11 calculates the results of the last in the storage section 13 If the calculation result is present on it, including the complementary observation telemetry value as that of the previous calculation result it is characterized in that to create the model. 1"
2014,"A power conversion device that can save the given active power command value and the invalid case to limit the power command value in consideration of the operation range specified by the power converter, to as small as possible to limit the amount of reactive power command value suppressing voltage fluctuation of the AC grid effect as much as possible for the purpose to obtain. Driving range and the available power in the range of the reference value Pref and its absolute value is applied to limit the reactive power command value Qref to be the maximum within the range of reactive power command limit value Qref * Q limiter 1 and driving range, and Qref for outputting * the value is applied to limit the Pref is maximized has an output limiting circuit 9 composed of P limiter 1 and 2 and outputting the effective power command Pref * limit. 2"
2014,"A system that links a plurality of converter operation is to get the software management apparatus capable of updating the software without interrupting the connection operation for the purpose. A movable condition detector 4 and for controlling the update operations of the incoming software update operation control unit 5 for detecting the operation status of the software, the update operation controller 5 if it is determined that it will need to update the entered software, updating of the inputted software updating, for each of the converter group to be the update is detected and the update target detection section 51 for detecting the converter group to be subjected to the destination, updating a group preliminary first and generates a renewal order to insert changes the role of group preliminary tile up sequence generation unit 52 and if, based on the operating situation is determined release possible in the atmosphere in the activation state calculator that is groups pre-and determined to be releasably, on the basis of the generated update order in the update operation instruction portion 53 for instructing to execute the update operation It was provided. 2"
2014,"After running a secure password rescue capabilities to reliably prevented from occurring it is defenseless. Exchanged between the external indicator 300 includes a receiving non-volatile memory 111 for storing the access authentication information according to user-specific authorization for use of HMI information processing unit 110 and an external indicator 300 to process information HMI. As a user-specific rights the art and access to up to the right other than the highest access rights is at least set. HMI information processing unit 110 is an external indicator 300 the IP when accessing through a communication network 200 to the protective control apparatus main body 100, For a non-volatile memory 111. The access authentication information of the highest access unregistered has access to prohibit the display of the login screen, authentication and a control to display only the registration screen. 1"
2014,Also in case the direct current component flowing through the system in the event of an accident to obtain a high-speed return is realized over current relay. Phase of the current I0 to remove the direct current component and the direct current component removed contained the first return signal that is based on a decision value Is to the effective value Irms returns the CB2 state closed from the open state to the over-current determination part 40 and the current I to the output the above processing based on the by the abnormal current I1 ~ I3 after the current over the current I0 before the above process after generating the I1 ~ I3 processing the processed outputs the second return signal returning the CB2 state closed from the open state to change the when current return determining section 50 and the first return signal with any one of the second return signal is inputted and a return control unit 60 stops the operation of the over-current signal component. 1
2014,"AMU2 are analog data representing the amount of electricity at the same time as receiving system in the CT / VT (8), converting the analog data input in synchronization with the synchronizing signal supplied from the outside as digital data, and outputs it to the IED (1). NMU (3) is to receive the synchronization signal generated for A / D conversion request signal and outputs it to the ECT / EVT (4). ECT / EVT (4) is to synchronously to the A / D conversion request signal from the NMU (3) to convert analog data to digital data and outputs it to the NMU (3). NMU (3) and outputs the input digital data to the IED (1). IED (1) is by delaying the phase of the digital data input from the AMU (2) to the IED (1), the AMU (2) and NMU (3) displacement of the A / D conversion timing between the (ECT / EVT4) to compensate."
2014,"An output harmonic component, even if the impedance of the power system (or load) that is connected to the AC side in the electric power conversion system is to multiplex the multi-phase power converter, the PWM control to resonate the carrier frequency band, thereby certainly reduced. A first three-level power converter 21 a, 22 a and the second three-level power converter 21 b, 22 b with the tank 21, 22 N set to be connected to the second electrode side of the alternating series is coupled to a first electrode of the alternating current or connected in parallel to multiplexes 2 N representative three-level power converter. And the control device 4 can slow the (2¥ð / 2N) two phases to each of the three-level power converter to generate a carrier wave and suppress the carrier frequency component of the neutral current through the 63 DC-side neutral point, the first three-level power converter 21 a, and the PWM control 22 in a AC voltage command V * and the PWM control in the second three-level power converter 21 b, in which the alternating current voltage command 22 b polarity inversion (-V *). 1"
2014,"By detecting a variation over the detector 13 a is output variation over a given inverter 4 in the active power fluctuation generator 9, and when detecting the output variations of the inverter 4 or more, an open output relay 5 to the relay-opening device 15, the grid-inverter to prevent a single operation."
